{
  "effective_time_frame": {
    "time_interval": {
      "start_date_time": "2026-04-09T22:30:00Z",
      "end_date_time": "2026-04-10T06:45:00Z"
    }
  },
  "total_sleep_time": {"value": 27600, "unit": "sec"},
  "wake_after_sleep_onset": {"value": 2100, "unit": "sec"},
  "is_main_sleep": true,
  "sleep_maintenance_efficiency_percentage": {"value": 92.5, "unit": "%"}
}
